{
    "task_id":  "002",
    "title":  "未来城市可漫游夜景升级",
    "map":  "M_WorldForgeBlockoutSandbox",
    "mode":  "preview_then_execute",
    "command":  "ExecuteCityUpgrade",
    "actor_limit":  60,
    "build_limit_per_step":  15,
    "checkpoint_required":  true,
    "allow_external_assets":  false,
    "allow_network":  false,
    "allow_delete_non_worldforge_actor":  false,
    "pie_test_seconds":  20,
    "quality_mode":  "low_load",
    "notes":  "仅通过离线任务文件驱动 UE 编辑器内执行层；不启用 Remote Control、MCP、WebSocket 或 HTTP 服务。"
}
